[
    {
        "id": "3146703",
        "enunciado": "Um antibiótico suspensão oral após o preparo para uso deve ser mantido em geladeira (2°C a 8°C) e é valido por um período de até 5 dias. Após a reconstituição, o frasco apresenta 60 mL da suspensão oral preparada.Considerando que o paciente deve usar 3 mL a cada12 horas, quantos frascos devem ser dispensados para um tratamento de 10 dias, considerando a validade do frasco após a reconstituição?",
        "alternativas": {
            "A": "1 frasco",
            "B": "2 frascos",
            "C": "3 frascos",
            "D": "4 frascos",
            "E": "5 frascos"
        },
        "gabarito_correto": "B",
        "comentario_ia": "O frasco tem 60 mL e a dose é 3 mL a cada 12h, totalizando 6 mL/dia. Dessa forma, um frasco dura 10 dias (60mL / 6mL/dia = 10 dias). O tratamento é de 10 dias, mas o frasco após preparo dura apenas 5 dias. Assim, serão necessários 2 frascos (um para os primeiros 5 dias e outro para os 5 dias restantes)."
    },
    {
        "id": "3146704",
        "enunciado": "O armazenamento é um conjunto de atividades necessárias para garantir a qualidade dos medicamentos e produtos para a saúde, por meio da proteção contra os riscos de alterações físico-químicas e biológicas, durante sua estocagem.Assinale a alternativa correta sobre armazenamento dos medicamentos no almoxarifado.",
        "alternativas": {
            "A": "Os medicamentos termo lábeis devem ser armazenados em geladeira, em temperatura de 1°Ca 8°C.",
            "B": "Os medicamentos devem ser estocados de acordo com as especificações do fabricante. Na ausência de especificações específicas, devem ser estocados em temperatura ambiente(15-35°C).",
            "C": "SQUARE A umidade deve ser controlada com o uso de termo-higrômetros. O grau de umidade para armazenamento dos medicamentos não deve ultrapassar 85%.",
            "D": "Caso o almoxarifado não possua geladeira, as insulinas podem ser armazenadas em temperatura ambiente desde que em temperaturas que não ultrapassem 30°C e que não fiquem expostas diretamente à luz solar, por até 90 dias.",
            "E": "Deve-se realizar diariamente o controle de temperatura e umidade do ambiente e da temperatura da geladeira onde estão armazenados os medicamentos termo lábeis."
        },
        "gabarito_correto": "E",
        "comentario_ia": "Sem comentário"
    },
    {
        "id": "3146705",
        "enunciado": "Um paciente deve receber uma dose total diária de 2 g de cefalexina, administrada a cada 6 horas.Considerando que o tratamento deve ser realizado em7 dias, qual o valor da dose unitária e qual o total a ser dispensado?",
        "alternativas": {
            "A": "250 mg / 28 g",
            "B": "500 mg e 2 g",
            "C": "500 mg / 14 g",
            "D": "1 g / 14 g",
            "E": "2 g / 14 g"
        },
        "gabarito_correto": "C",
        "comentario_ia": "A dose diária é 2g (2000mg) dividida a cada 6h, o que totaliza 4 doses/dia. A dose unitária é 2000mg/4 = 500mg. Em 7 dias, o total dispensado é 2000mg/dia * 7 dias = 14000mg = 14g."
    },
    {
        "id": "3146706",
        "enunciado": "Se 150 g de um medicamento são usados para preparar 200 cápsulas, indique a dose diária do mesmo se uma cápsula for administrada três vezes ao dia.",
        "alternativas": {
            "A": "0,25 g",
            "B": "0,75 g",
            "C": "1,5 g",
            "D": "2,25 g",
            "E": "3 g"
        },
        "gabarito_correto": "D",
        "comentario_ia": "Sem comentário"
    },
    {
        "id": "3146707",
        "enunciado": "A dose de um medicamento é de 15 mg/kg. Qual a dose a ser administrada para um adulto de70 kg e para uma criança de 25 kg, respectivamente?",
        "alternativas": {
            "A": "1.200 mg / 300 mg",
            "B": "1.050 mg / 375 mg",
            "C": "1 g / 0,375 g",
            "D": "375 mg / 1.050 mg",
            "E": "0,105 mg / 37,5 mg"
        },
        "gabarito_correto": "B",
        "comentario_ia": "Para o adulto: é 15 mg/kg * 70 kg = 1050 mg. Para a criança: é 15 mg/kg * 25 kg = 375 mg. As doses são 1050 mg e 375 mg, nessa ordem."
    },
    {
        "id": "3146708",
        "enunciado": "A avaliação da estabilidade é uma das etapas mais importantes no desenvolvimento dos medicamentos e objetiva garantir a qualidade, a segurança e a eficácia dos produtos. A estabilidade de um fármaco e da forma farmacêutica que contém esse fármaco podem ser afetadas por fatores extrínsecos e intrínsecos.Assinale a alternativa correta sobre a estabilidade.",
        "alternativas": {
            "A": "Deve-se fazer uma inspeção visual dos medicamentos na dispensação para detectar possíveis sinais físicos que podem estar associados à perda da estabilidade. Caso seja identificado algum desses sinais, o medicamento deve ser segregado e não entregue ao paciente.",
            "B": "São fatores extrínsecos que afetam a estabilidade dos medicamentos: tempo, temperatura, umidade, luz, oxigênio, oxidação e hidrólise.",
            "C": "As formas farmacêuticas semissólidas são mais estáveis que as formas farmacêuticas líquidas e as sólidas.",
            "D": "O prazo de validade de um medicamento informado pelo fabricante deve ser sempre considerado, mesmo que o medicamento tenha sido exposto a fatores que alterem a sua estabilidade.",
            "E": "Se exposta a altas temperaturas e a alta umidade, uma cápsula só deve ser descartada se apresentar sinais visíveis de alterações como amolecimento ou endurecimento, precipitação ou manchas na superfície."
        },
        "gabarito_correto": "A",
        "comentario_ia": "A alternativa A destaca a importância da inspeção visual na dispensação para identificar perdas de estabilidade. As outras alternativas contêm incorreções sobre fatores extrínsecos, comparação de estabilidade de formas farmacêuticas e descarte de medicamentos."
    },
    {
        "id": "3146709",
        "enunciado": "Na dispensação de medicamentos devem ser dadas orientações no sentido de promover o uso correto e seguro dos medicamentos. Considerando as orientações na dispensação dos medicamentos, assinale a alternativa correta.",
        "alternativas": {
            "A": "No uso de colírios, o paciente não deve encostar o aplicador do frasco no olho para evitar a contaminação do frasco.",
            "B": "Para obter a dosagem indicada no tratamento, o usuário pode partir comprimidos (com ou sem sulcos), independente da forma de revestimento.",
            "C": "Comprimidos, cápsulas ou drágeas de tamanho pequeno não devem ingeridos com água. Recomenda-se o uso de água somente para tamanhos maiores.",
            "D": "Não se recomenda que suspensões sejam agitadas antes do uso, pois a agitação pode interferir no funcionamento do fármaco.",
            "E": "Para facilitar a deglutição, o paciente pode mastigar comprimidos e drágeas ou abrir cápsulas, misturando o conteúdo com água."
        },
        "gabarito_correto": "A",
        "comentario_ia": "A alternativa A está correta ao orientar o não toque do aplicador do colírio no olho para evitar contaminação. As demais alternativas descrevem práticas incorretas e perigosas no uso de medicamentos."
    },
    {
        "id": "3091328",
        "enunciado": "A adoção da Relação Nacional de Medicamentos Essenciais é uma das diretrizes da Política Nacional de Medicamentos (PNM). Segundo essa política:",
        "alternativas": {
            "A": "medicamentos essenciais são aqueles empregados no tratamento de doenças crônicas ou degenerativas, utilizados continuamente.",
            "B": "a atualização periódica da Relação Nacional de Medicamentos Essenciais (RENAME), é responsabilidade da ANVISA.",
            "C": "medicamentos essenciais são aqueles produtos considerados básicos e indispensáveis para atender a maioria dos problemas de saúde da população.",
            "D": "medicamentos essenciais são aqueles produtos produzidos unicamente por laboratórios públicos.",
            "E": "medicamentos essenciais são aqueles cuja dispensação não requer autorização, ou seja, receita expedida por profissional."
        },
        "gabarito_correto": "C",
        "comentario_ia": "Sem comentário"
    },
    {
        "id": "3091329",
        "enunciado": "De acordo com a Política Nacional de Medicamentos, a promoção do uso racional de medicamentos envolverá quais medidas?",
        "alternativas": {
            "A": "Elaboração do Formulário Terapêutico Nacional",
            "B": "Aquisição de medicamentos do setor público exclusivamente por licitação",
            "C": "Registro e uso de medicamentos similares",
            "D": "Registro e uso de medicamentos que são referência apresentam consequentemente maior credibilidade",
            "E": "Campanhas de caráter educativos de responsabilidade única do SUS"
        },
        "gabarito_correto": "A",
        "comentario_ia": "A elaboração do Formulário Terapêutico Nacional é uma medida chave para o uso racional de medicamentos, visando padronizar e otimizar a prescrição e dispensação, conforme a política nacional."
    },
    {
        "id": "3091330",
        "enunciado": "Hemoderivados são produtos oriundos do sangue total ou do plasma, obtidos por meio de processamento físico-químico ou biotecnológico que, quando descartados incorretamente acarretam em riscos à saúde e meio ambiente. Segundo as Boas Práticas de Gerenciamento dos Resíduos de Serviços de Saúde (RDC 222/18, os hemoderivados descartados como resíduo de que grupo?",
        "alternativas": {
            "A": "Grupo A",
            "B": "Grupo B",
            "C": "Grupo C",
            "D": "Grupo D",
            "E": "Grupo E"
        },
        "gabarito_correto": "B",
        "comentario_ia": "Sem comentário"
    },
    {
        "id": "3091331",